"81";"DF";"Sociedade de Abastecimento de Brasília - SAB";"EM LIQUIDAÇÃO";"ABASTECIMENTO DE ALIMENTOS E OUTROS INSUMOS";"EMPRESA PÚBLICA";"Dependente";625362,24;237447,43;"SIM";"SIM";"NÃO";276249,35;"Não";134;0;22346832,4;0;22737753,2;21577561,03;0;0;16368857,49;0;0;"nan";"Distrito Federal";"Centro-oeste";FALSE;FALSE;-22737753,2
"82";"DF";"Sociedade de Transportes Coletivos de Brasília - TCB";"ATIVA";"TRANSPORTE";"EMPRESA PÚBLICA";"Dependente";65498439,17;-4541813,01;"SIM";"SIM";"NÃO";329113,19;"Não";1112;5946158;53795238,83;0;0;0;5500000;9662620;38386200;9662620;9662620;"Carta-de-servicos-ao-cidadao-2021,pdf (tcb,df,gov,br)";"Distrito Federal";"Centro-oeste";FALSE;FALSE;-5500000
"83";"DF";"Companhia Imobiliária de Brasília - Terracap";"ATIVA";"DESENVOLVIMENTO REGIONAL";"EMPRESA PÚBLICA";"Não Dependente";4553215554,82;1741509742,08;"SIM";"SIM";"SIM";919925,18;"Sim";733;110254557,38;243876224,81;0;0;0;0;0;1848848613,47;0;0;"https://www,terracap,df,gov, br/index,php/acessoinformacao/normas-manuaise-politicas";"Distrito Federal";"Centro-oeste";TRUE;FALSE;0
"84";"ES";"CEASA- Centrais de Abastecimento do Espírito Santo S/A";"ATIVA";"ABASTECIMENTO DE ALIMENTOS E OUTROS INSUMOS";"SOCIEDADE DE ECONOMIA MISTA";"Dependente";8180258,07;162481;"SIM";"SIM";"NÃO";400107,26;"Não";79;24313;4006496,98;0;0;0;0;0;3159556,67;0;0;"https://ceasa,es,gov,br/governanca-corporativa";"Espiríto Santo";"Sudeste";FALSE;FALSE;0
"85";"ES";"COHAB- Companhia de Habitação e Urbanização do Estado do Espírito Santo- em liquidação";"EM LIQUIDAÇÃO";"HABITAÇÃO E URBANIZAÇÃO";"SOCIEDADE DE ECONOMIA MISTA";"Dependente";14971000;24000;"NÃO";"SIM";"NÃO";82524;"Não";21;0;1409743,99;0;1568000;2758000;0;0;4525000;0;0;"https://seger,es,gov,br/autarquias";"Espiríto Santo";"Sudeste";FALSE;FALSE;-1568000
"86";"ES";"Banestes- Banco do Estado do Espírito Santo";"ATIVA";"FINANCEIRO";"SOCIEDADE DE ECONOMIA MISTA";"Não Dependente";1889666000;250590000;"SIM";"SIM";"SIM";574718,66;"Sim";2035;64733000;373317000;77384311;0;0;0;0;1477920000;281728500;0;"https://www,banestes,com,br/ri/ri_governanca,html";"Espiríto Santo";"Sudeste";TRUE;FALSE;77384311
"87";"ES";"BANDES Banco de Desenvolvimento do Espírito Santo";"ATIVA";"FINANCEIRO";"SOCIEDADE DE ECONOMIA MISTA";"Não Dependente";314798000;50136000;"SIM";"SIM";"SIM";198207,6;"Sim";161;3232621;37975000;0;0;0;0;20148517,23;439371000;0;0;"https://www,bandes,com,br/Site/Dinamico/Show/69/Governanca-Corporativa";"Espiríto Santo";"Sudeste";TRUE;FALSE;0
"88";"ES";"Cesan - Companhia Espirito Santense de Saneamento";"ATIVA";"SANEAMENTO";"SOCIEDADE DE ECONOMIA MISTA";"Não Dependente";3098340000;177153000;"SIM";"SIM";"SIM";0;"Sim";1321;371384000;217861000;0;0;0;75115173,89;45228437,74;2477098526,48;155820257,48;155820257;"https://www,cesan,com,br/governanca-corporativa";"Espiríto Santo";"Sudeste";TRUE;FALSE;-75115173,89
"89";"ES";"Ceturb - Companhia Estadual de Transportes Coletivos de Passageiros do Espirito Santo";"ATIVA";"TRANSPORTE";"EMPRESA PÚBLICA";"Não Dependente";5712946,35;-4714996,33;"SIM";"SIM";"NÃO";234500,77;"Não";187;452974,25;38474112,77;0;0;0;689746,67;2361161,47;93473015,36;0;0;"https://ceturb,es,gov,br/missao-visao-e-valores";"Espiríto Santo";"Sudeste";FALSE;FALSE;-689746,67
"90";"ES";"ES GÁS - Companhia de Gás do Espirito Santo";"ATIVA";"GÁS E DERIVADOS";"SOCIEDADE DE ECONOMIA MISTA";"Não Dependente";704705755,53;98142450,31;"SIM";"SIM";"SIM";291720,16;"Não";12;14760000;4488381,44;4307364,37;0;0;0;0;254332619;0;0;"https://esgas,com,br/governanca-corporativa";"Espiríto Santo";"Sudeste";TRUE;FALSE;4307364,37
"91";"GO";"Agência Goiana de Gás Canalizado S/A - GOIASGÁS";"ATIVA";"GÁS E DERIVADOS";"SOCIEDADE DE ECONOMIA MISTA";"Não Dependente";345057,28;-713220,06;"SIM";"SIM";"NÃO";11450;"Não";3;34028,13;333695,66;0;0;0;0;0;0;0;0;"http://www.goiasgas.com.br";"Goiás";"Centro-oeste";FALSE;FALSE;0
"92";"GO";"Agência Goiana de Habitação S/A - AGEHAB";"ATIVA";"HABITAÇÃO E URBANIZAÇÃO";"SOCIEDADE DE ECONOMIA MISTA";"Dependente";19541815,71;9454732,76;"SIM";"SIM";"NÃO";346898,47;"Não";224;6603001,13;29387328,05;0;36703140,13;28495045,4;0;0;187256418,03;0;0;"https://www,agehab,go,gov,br";"Goiás";"Centro-oeste";FALSE;FALSE;-36703140,13
"93";"GO";"CELG Geração e Transmissão S/A - CELG G T (Torna-se subsidiária da CELGPAR)";"ATIVA";"ENERGIA";"SOCIEDADE DE ECONOMIA MISTA";"Não Dependente";0;0;"SIM";"SIM";"SIM";0;"Não";0;0;0;0;0;0;0;0;0;0;0;"http://celgpar.celggt.com";"Goiás";"Centro-oeste";TRUE;FALSE;0
"94";"GO";"Companhia Celg de Participações - CELGPAR";"ATIVA";"ENERGIA";"SOCIEDADE DE ECONOMIA MISTA";"Não Dependente";1586840797,51;169818826,99;"SIM";"SIM";"SIM";599076,54;"Não";37;0;5971220,56;0;0;0;0;0;0;-2786463704,94;0;"http://celgpar,celggt,com";"Goiás";"Centro-oeste";TRUE;FALSE;0
"95";"GO";"Indústria Química do Estado de Goiás - IQUEGO";"ATIVA";"GESTÃO DE ATIVOS";"SOCIEDADE DE ECONOMIA MISTA";"Dependente";5425397,12;6283183,71;"SIM";"SIM";"SIM";284070,02;"Não";67;44018,2;7000577,49;0;10388665,22;1503000;0;0;239994409;0;0;"http://www,iquego,go,gov,br";"Goiás";"Centro-oeste";TRUE;FALSE;-10388665,22
"96";"GO";"Agência de Fomento de Goiás S/A - GOIASFOMENTO";"ATIVA";"FINANCEIRO";"SOCIEDADE DE ECONOMIA MISTA";"Não Dependente";197118258,17;342321,15;"SIM";"SIM";"NÃO";354170,9;"Sim";130;0;24309646,56;0;0;0;4e+06;0;186069209,48;6292252,13999999;6292252,13999999;"http://www,goiasfomento,com";"Goiás";"Centro-oeste";FALSE;FALSE;-4e+06
"97";"GO";"Caixa Econômica do Estado de Goiás - CAIXEGO";"EM LIQUIDAÇÃO";"FINANCEIRO";"EMPRESA PÚBLICA";"Não Dependente";-425197217,7;0;"NÃO";"NÃO";"NÃO";0;"Não";0;0;0;0;0;0;0;0;0;-1,24;0;"http://www.goiasfomento.com";"Goiás";"Centro-oeste";FALSE;FALSE;0
"98";"GO";"Goiás Telecomunicções S/A - GOIAS TELECOM";"ATIVA";"COMUNICAÇÃO";"SOCIEDADE DE ECONOMIA MISTA";"Dependente";-262287,44;545705,22;"SIM";"SIM";"NÃO";240495;"Não";23;24333,86;1841471,12;0;1459074,45;1466949,52;0;4e+07;8999950;0;0;"https://goiastelecom,go,gov,br";"Goiás";"Centro-oeste";FALSE;FALSE;-1459074,45
"99";"GO";"Metrobus Transporte Coletivo S/A - METROBUS";"ATIVA";"TRANSPORTE";"SOCIEDADE DE ECONOMIA MISTA";"Dependente";202506,78;-391602,98;"SIM";"SIM";"NÃO";233012,47;"Não";352;1458228,35;35891821,22;0;39772822,54;17400000;0;0;221702474,55;0;0;"https://www,metrobus,go,gov,br";"Goiás";"Centro-oeste";FALSE;FALSE;-39772822,54
"100";"GO";"Centrais de Abastecimento de Goiás S/A - CEASA/GO";"ATIVA";"ABASTECIMENTO DE ALIMENTOS E OUTROS INSUMOS";"SOCIEDADE DE ECONOMIA MISTA";"Não Dependente";15554129,57;607723,8;"SIM";"SIM";"NÃO";311199,08;"Não";71;541517,88;11846349,75;0;0;0;0;0;19435689,84;0;0;"https://www,ceasa,go,gov,br";"Goiás";"Centro-oeste";FALSE;FALSE;0
"101";"GO";"Companhia de Armazéns e Silos do Estado de Goiás S/A - CASEGO";"EM LIQUIDAÇÃO";"ABASTECIMENTO DE ALIMENTOS E OUTROS INSUMOS";"SOCIEDADE DE ECONOMIA MISTA";"Dependente";30997335,75;6193251,42;"NÃO";"SIM";"NÃO";12000;"Não";0;0;48782,8;0;43200;44020;0;0;82346820;0;0;"http://www,administracao,go,gov,br";"Goiás";"Centro-oeste";FALSE;FALSE;-43200
"102";"GO";"Companhia de Desenvolvimento Econômico de Goiás - CODEGO";"ATIVA";"DESENVOLVIMENTO REGIONAL";"SOCIEDADE DE ECONOMIA MISTA";"Não Dependente";335387912,22;11782739,28;"SIM";"SIM";"SIM";33401,96;"Não";360;0;31014064,31;0;0;0;0;0;410151333;176100925;122022692;"http://www,goiasindustrial,com,br";"Goiás";"Centro-oeste";TRUE;FALSE;0
"103";"GO";"Empresa de Assistência Técnica, Extenção Rural e Pesquisa Agropecuária do Estado de Goiás - EMATER (Baixada em 16/11/2021)";"EM LIQUIDAÇÃO";"PESQUISA E ASSISTÊNCIA TÉCNICA AGROPECUÁRIA";"EMPRESA PÚBLICA";"Dependente";5433217,21;1816651,8;"NÃO";"SIM";"NÃO";8000;"Não";0;0;28800;0;28800;44130;0;0;3616565,41;0;0;"http://www,administracao,go,gov,br";"Goiás";"Centro-oeste";FALSE;FALSE;-28800
"104";"GO";"Empresa Estadual de Processamento de Dados de Goiás - PRODAGO";"EM LIQUIDAÇÃO";"INFORMÁTICA E TECNOLOGIA DA INFORMAÇÃO";"EMPRESA PÚBLICA";"Dependente";-391884841,78;-26791293,35;"NÃO";"SIM";"NÃO";227499,74;"Não";24;0;3112089,86;0;9535223,23;22074438,07;11897502,17;0;23238721,38;11897502,17;0;"http://www,administracao,go,gov,br";"Goiás";"Centro-oeste";FALSE;FALSE;-21432725,4
"105";"GO";"Metais de Goiás S/A - METAGO";"EM LIQUIDAÇÃO";"MINERAÇÃO";"SOCIEDADE DE ECONOMIA MISTA";"Dependente";18382293,48;-4537609,43;"NÃO";"SIM";"NÃO";12000;"Não";0;0;47653,28;0;43200;44130;0;0;54698546,73;0;0;"http://www,administracao,go,gov,br";"Goiás";"Centro-oeste";FALSE;FALSE;-43200
"106";"GO";"Saneamento de Goiás S/A - SANEAGO";"ATIVA";"SANEAMENTO";"SOCIEDADE DE ECONOMIA MISTA";"Não Dependente";3356818;352456;"SIM";"SIM";"SIM";767488,48;"Sim";6993;223779;1109707;534520;0;502000;0;0;2515546000;0;0;"https://www,saneago,com,br";"Goiás";"Centro-oeste";TRUE;FALSE;534520
"107";"GO";"Companhia de Investimento e Parcerias do Estado de Goiás - GOIASPARCERIAS";"ATIVA";"DESENVOLVIMENTO REGIONAL";"SOCIEDADE DE ECONOMIA MISTA";"Não Dependente";229395180,35;1026384,77;"SIM";"SIM";"NÃO";240933,33;"Não";38;0;6058098,38;0;0;0;0;0;347607531,65;-5990000;-6000000,02999997;"https://www.goiasparcerias.go.gov.br";"Goiás";"Centro-oeste";FALSE;FALSE;0
"108";"MA";"Maranhão Parcerias (MAPA)";"ATIVA";"GESTÃO DE ATIVOS";"EMPRESA PÚBLICA";"Dependente";10444954,84;-58145058,41;"SIM";"SIM";"NÃO";258211,8;"Não";585;624831;44961894,55;0;0;0;0;0;75884853,01;75884853,01;0;"https://mapa,ma,gov,br/programas-ou-campanhas/carta-anual";"Maranhão";"Nordeste";FALSE;FALSE;0
"109";"MA";"Empresa Maranhense de Administração Portuária (EMAP)";"ATIVA";"PORTOS E HIDROVIAS";"EMPRESA PÚBLICA";"Não Dependente";644173018;109940936;"SIM";"SIM";"SIM";759561;"Sim";230;48089927;91655655;0;0;0;0;0;370668392;0;0;"https://www,portodoitaqui,com/emap/carta-anual";"Maranhão";"Nordeste";TRUE;FALSE;0
"110";"MA";"Companhia de Saneamento Ambiental do Maranhão (CAEMA)";"ATIVA";"SANEAMENTO";"EMPRESA PÚBLICA";"Não Dependente";907322927;-16280230;"SIM";"SIM";"SIM";34578;"Não";1991;39660257;268000331;0;0;0;114852341;100346304;2249482402;0;0;"https://www,caema,ma,gov,br/index,php/a-caema/governanca/carta-anual";"Maranhão";"Nordeste";TRUE;FALSE;-114852341
"111";"MA";"Companhia Maranhense de Gás (GASMAR)";"ATIVA";"ENERGIA";"SOCIEDADE DE ECONOMIA MISTA";"Não Dependente";18145220,83;34564883,36;"SIM";"SIM";"NÃO";243869;"Sim";59;407995,86;8454592,03;8814045,26;0;0;0;0;7920000;0;0;"https://www,gasmar,com,br/colaborador/TRANSPAR%C3%8ANCIA/8,Relat%C3%B3rio%20de%20Administra%C3%A7%C3%A3o%20GASMAR%202021,pdf";"Maranhão";"Nordeste";FALSE;FALSE;8814045,26
"112";"MA";"Empresa Maranhense de Serviços Hospitalares (EMSERH)";"ATIVA";"SAÚDE";"EMPRESA PÚBLICA";"Dependente";417864192,76;156786744,64;"SIM";"SIM";"SIM";255021,45;"Não";15383;0;589820742,01;0;1615548448,85;1316839067,41;0;0;1e+06;0;0;"http://www,emserh,ma,gov,br/";"Maranhão";"Nordeste";TRUE;FALSE;-1615548448,85
"113";"MT";"COMPANHIA MATOGROSSENSE DE GÁS - MT GÁS";"ATIVA";"GÁS E DERIVADOS";"SOCIEDADE DE ECONOMIA MISTA";"Dependente";11911978;-2806223;"SIM";"SIM";"NÃO";1733373,13;"Não";16;0;2623090;0;0;0;0;0;8500007;0;0;"nan";"Mato Grosso";"Centro-oeste";FALSE;FALSE;0
"114";"MT";"CENTRAL DE ABASTECIMENTO DO ESTADO DE MATO GROSSO - CEASA MT";"ATIVA";"ABASTECIMENTO DE ALIMENTOS E OUTROS INSUMOS";"SOCIEDADE DE ECONOMIA MISTA";"Dependente";55846,15;0;"SIM";"SIM";"NÃO";183636,8;"Não";0;0;886531,39;0;935430,38;1695196,28;0;0;751100;0;0;"nan";"Mato Grosso";"Centro-oeste";FALSE;FALSE;-935430,38
"115";"MT";"AGÊNCIA DE FOMENTO DO ESTADO DE MATO GROSSO S A - DESENVOLVE - MT";"ATIVA";"FINANCEIRO";"SOCIEDADE DE ECONOMIA MISTA";"Não Dependente";132856633;921044;"SIM";"SIM";"NÃO";292242,6;"Não";94;0;10575100;0;0;0;1,09e+08;0;131560547,88;112412551,41;10900000,21;"nan";"Mato Grosso";"Centro-oeste";FALSE;FALSE;-1,09e+08
"116";"MT";"EMPRESA MATOGROSSENSE DE PESQUISA. ASSISTÊNCIA E EXTENSÃO RURAL - EMPAER MT";"ATIVA";"PESQUISA E ASSISTÊNCIA TÉCNICA AGROPECUÁRIA";"EMPRESA PÚBLICA";"Dependente";-77217620,24;5238127,23;"SIM";"SIM";"NÃO";323774,49;"Não";360;0;138491480,19;0;146013517,43;155052104,14;0;0;34889260,76;0;0;"nan";"Mato Grosso";"Centro-oeste";FALSE;FALSE;-146013517,43
"117";"MT";"COMPANHIA MATOGROSSENSE DE MINERAÇÃO - METAMAT";"ATIVA";"MINERAÇÃO";"SOCIEDADE DE ECONOMIA MISTA";"Dependente";61171276;-3647571;"SIM";"SIM";"SIM";328108,28;"Não";75;0;16982505;0;27312642,08;11932666;0;0;61171276;0;0;"nan";"Mato Grosso";"Centro-oeste";TRUE;FALSE;-27312642,08
"118";"MT";"MT PARTICIPAÇÕES E PROJETOS S/A - MT PAR";"ATIVA";"GESTÃO DE ATIVOS";"SOCIEDADE DE ECONOMIA MISTA";"Dependente";40183937,95;979243,19;"SIM";"SIM";"NÃO";803003,68;"Não";69;8897503,13;6308658,92;0;8339515,98;4202115,27;0;0;41200751,25;0;0;"nan";"Mato Grosso";"Centro-oeste";FALSE;FALSE;-8339515,98
"119";"MT";"EMPRESA MATO-GROSSENSE DE TECNOLOGIA DA INFORMAÇÃO - MTI";"ATIVA";"INFORMÁTICA E TECNOLOGIA DA INFORMAÇÃO";"EMPRESA PÚBLICA";"Dependente";29976003,86;12109492,36;"SIM";"SIM";"NÃO";460486;"Não";304;13450000;99064357,32;0;69553088,76;53883553,28;2,7e+07;0;55880438,73;2,7e+07;0;"nan";"Mato Grosso";"Centro-oeste";FALSE;FALSE;-96553088,76
"120";"MT";"COMPANHIA DE SANEAMENTO DO ESTADO DE MATO GROSSO - SANEMAT";"EM LIQUIDAÇÃO";"SANEAMENTO";"SOCIEDADE DE ECONOMIA MISTA";"Dependente";-78637604;-24367492,93;"SIM";"SIM";"NÃO";179358,13;"Não";7;0;1633432,7;0;0;0;0;0;283557904;0;0;"nan";"Mato Grosso";"Centro-oeste";FALSE;FALSE;0
"121";"MS";"EMPRESA DE SERVIÇOS AGROPECUÁRIOS DE MS - AGROSUL";"EM LIQUIDAÇÃO";"PESQUISA E ASSISTÊNCIA TÉCNICA AGROPECUÁRIA";"EMPRESA PÚBLICA";"Dependente";-930486891,76;-60354984,43;"NÃO";"SIM";"NÃO";0;"Não";0;0;0;0;0;0;0;0;0;0;0;"0";"Mato Grosso do Sul";"Centro-oeste";FALSE;FALSE;0
"122";"MS";"EMPRESA DE GESTÃO DE RECURSOS MINERAIS - MS MINERAL";"ATIVA";"MINERAÇÃO";"EMPRESA PÚBLICA";"Dependente";1200930,12;1140665,7;"SIM";"SIM";"SIM";0;"Não";0;0;0;0;23876;23876;0;0;0;0;0;"0";"Mato Grosso do Sul";"Centro-oeste";TRUE;FALSE;-23876
"123";"MS";"EMPRESA DE SANEAMENTO DE MATO GROSSO DO SUL S.A - SANESUL";"ATIVA";"SANEAMENTO";"SOCIEDADE DE ECONOMIA MISTA";"Não Dependente";969090567,03;96442685,7;"SIM";"SIM";"SIM";433898,61;"Sim";1404;117818660,21;162820969,74;0;0;0;47318599,62;0;709744906,2;47318599,62;0;"0";"Mato Grosso do Sul";"Centro-oeste";TRUE;FALSE;-47318599,62
"124";"MS";"CENTRAIS DE ABASTECIMENTO DE MATO GROSSO DO SUL S/A - CEASA/MS";"ATIVA";"ABASTECIMENTO DE ALIMENTOS E OUTROS INSUMOS";"SOCIEDADE DE ECONOMIA MISTA";"Não Dependente";1003376,61;256268,5;"SIM";"SIM";"NÃO";59389,19;"Não";48;145260,4;1523066,33;0;0;0;0;0;0;0;0;"0";"Mato Grosso do Sul";"Centro-oeste";FALSE;FALSE;0
"125";"MS";"LOTESUL - LOTERIAL ESTADUAL DE MS";"ATIVA";"OUTROS";"EMPRESA PÚBLICA";"Não Dependente";0;0;"NÃO";"NÃO";"NÃO";0;"Não";0;0;0;0;0;0;0;0;0;0;0;"0";"Mato Grosso do Sul";"Centro-oeste";FALSE;FALSE;0
"126";"MS";"COMPANHIA DE GAS DO ESTADO DE MATO GROSSO DO SUL";"ATIVA";"GÁS E DERIVADOS";"SOCIEDADE DE ECONOMIA MISTA";"Não Dependente";135629898,99;52258377,5;"SIM";"SIM";"SIM";31707,96;"Sim";85;22424735,51;14284961,61;12508229,05;0;0;0;0;24520800;18005550;18005550;"0";"Mato Grosso do Sul";"Centro-oeste";TRUE;FALSE;12508229,05
"127";"MG";"BANCO DE DESENVOLVIMENTO DE MINAS GERAIS S.A. - BDMG";"ATIVA";"FINANCEIRO";"EMPRESA PÚBLICA";"Não Dependente";2080669385,01;231176845,08;"SIM";"SIM";"SIM";488831,24;"Sim";591;8898087,4;119738516,1;0;0;0;0;105724344,5;1908303319,98;0;0;"https://www,bdmg,mg,gov,br/wp-content/uploads/2022/05/Carta-Anual-Politicas-Publicas-e-Gov,-Corporativa-BDMG_2021,pdf";"Minas gerais";"Sudeste";TRUE;FALSE;0
"128";"MG";"COMPANHIA ENERGÉTICA DE MINAS GERAIS - CEMIG (*)";"ATIVA";"ENERGIA";"SOCIEDADE DE ECONOMIA MISTA";"Não Dependente";19461765503;3752868376,04;"SIM";"SIM";"SIM";1196513,61;"Sim";20942;2,123e+09;62377477,22;112939806,84;0;0;0;0;1442493875;148741380;29748276;"https://www,cemig,com,br/wp-content/uploads/2021/07/Cemig-Carta-Anual-Politicas-Publicas-e-Governanca-2021,pdf";"Minas gerais";"Sudeste";TRUE;FALSE;112939806,84
"129";"MG";"CEMIG DISTRIBUIÇÃO S.A. - CEMIG D";"ATIVA";"ENERGIA";"SOCIEDADE DE ECONOMIA MISTA";"Não Dependente";6942666724,25;1700541453,53;"SIM";"SIM";"SIM";1519903,89;"Sim";19546;1,646e+09;2096888584,91;0;0;0;0;0;0;0;0;"https://www,cemig,com,br/wp-content/uploads/2021/07/Cemig-Carta-Anual-Politicas-Publicas-e-Governanca-2021,pdf";"Minas gerais";"Sudeste";TRUE;FALSE;0
"130";"MG";"CEMIG GERAÇÃO E TRANSMISSÃO S.A. - CEMIG GT";"ATIVA";"ENERGIA";"SOCIEDADE DE ECONOMIA MISTA";"Não Dependente";7755454588,57;871433235,4;"SIM";"SIM";"SIM";1233202,11;"Sim";1341;4,1e+08;500865524,6;0;0;0;0;0;0;0;0;"https://www,cemig,com,br/wp-content/uploads/2021/07/Cemig-Carta-Anual-Politicas-Publicas-e-Governanca-2021,pdf";"Minas gerais";"Sudeste";TRUE;FALSE;0
"131";"MG";"COMPANHIA DE GÁS DE MINAS GERAIS - GASMIG";"ATIVA";"GÁS E DERIVADOS";"SOCIEDADE DE ECONOMIA MISTA";"Não Dependente";1221598911,44;360744535,96;"SIM";"SIM";"SIM";404870,46;"Sim";263;54244119,5;52196107,24;0;0;0;0;0;0;0;0;"https://www,rad,cvm,gov,br/ENET/frmExibirArquivoIPEExterno,aspx?NumeroProtocoloEntrega=956512";"Minas gerais";"Sudeste";TRUE;FALSE;0
"132";"MG";"COMPANHIA DE DESENVOLVIMENTO DE MINAS GERAIS - CODEMGE";"ATIVA";"DESENVOLVIMENTO REGIONAL";"SOCIEDADE DE ECONOMIA MISTA";"Não Dependente";1908137683,76;1060295244,15;"SIM";"SIM";"SIM";551138,3;"Sim";665;31545527,17;99026599,86;421975412,18;0;0;0;0;751085858,98;0;0;"http://www,codemge,com,br/a-codemge/governanca/";"Minas gerais";"Sudeste";TRUE;FALSE;421975412,18
"133";"MG";"COMPANHIA DE DESENVOLVIMENTO ECONÔMICO DE MINAS GERAIS - CODEMIG";"ATIVA";"DESENVOLVIMENTO REGIONAL";"SOCIEDADE DE ECONOMIA MISTA";"Não Dependente";603485349,24;1255618929,31;"SIM";"SIM";"SIM";0;"Não";0;0;4088329,03;694984631,1;0;0;0;0;5028066,57;0;0;"http://www,codemge,com,br/a-codemge/governanca/";"Minas gerais";"Sudeste";TRUE;FALSE;694984631,1
"134";"MG";"COMPANHIA DE HABITAÇÃO DO ESTADO DE MINAS GERAIS - COHAB MINAS";"ATIVA";"HABITAÇÃO E URBANIZAÇÃO";"SOCIEDADE DE ECONOMIA MISTA";"Não Dependente";-127920000;-70281000;"SIM";"SIM";"NÃO";385352,37;"Não";204;0;31015000;0;0;0;7e+06;1,5e+07;77986000;7e+06;7e+06;"http://www,cohab,mg,gov,br/carta-anual-de-politicas-publicas-e-governanca-corporativa/";"Minas gerais";"Sudeste";FALSE;FALSE;-7e+06
"135";"MG";"COPASA SERVIÇOS DE SANEAMENTO INTEGRADO DO NORTE E NORDESTE DE MINAS GERAIS S/A - COPANOR";"ATIVA";"SANEAMENTO";"SOCIEDADE DE ECONOMIA MISTA";"Não Dependente";202181465,73;-12690632,5;"NÃO";"SIM";"NÃO";101656,03;"Não";477;36494964,81;18935487,75;0;0;0;0;0;0;0;0;"https://api,mziq,com/mzfilemanager/v2/d/8bdb3906-0618-4e78-bbe3-a0be9f02d8cc/5fc9954c-d988-0c13-89a7-67662f43a84c?origin=2,";"Minas gerais";"Sudeste";FALSE;FALSE;0
"136";"MG";"COMPANHIA DE SANEAMENTO DE MINAS GERAIS - COPASA MG";"ATIVA";"SANEAMENTO";"SOCIEDADE DE ECONOMIA MISTA";"Não Dependente";6759957765,9;537587197,58;"SIM";"SIM";"SIM";889322,66;"Sim";11199;997973329,24;1685628715,42;179755072,27;0;0;0;0;1702553758,97;0;0;"https://api,mziq,com/mzfilemanager/v2/d/8bdb3906-0618-4e78-bbe3-a0be9f02d8cc/5fc9954c-d988-0c13-89a7-67662f43a84c?origin=2,";"Minas gerais";"Sudeste";TRUE;FALSE;179755072,27
"137";"MG";"EMPRESA DE ASSISTÊNCIA TÉCNICA E EXTENSAO RURAL DO ESTADO DE MINAS GERAIS - EMATER-MG";"ATIVA";"PESQUISA E ASSISTÊNCIA TÉCNICA AGROPECUÁRIA";"EMPRESA PÚBLICA";"Dependente";64585113,41;5583348,88;"SIM";"SIM";"NÃO";378768,91;"Não";2284;6503758,07;276976816,54;0;209963339,26;222661826,24;0;0;48591258,98;0;0;"https://www,emater,mg,gov,br/download,do?id=21592";"Minas gerais";"Sudeste";FALSE;FALSE;-209963339,26
"138";"MG";"EMPRESA MINEIRA DE COMUNICAÇÃO LTDA - EMC";"ATIVA";"COMUNICAÇÃO";"EMPRESA PÚBLICA";"Dependente";35255236,69;-676246,39;"SIM";"SIM";"NÃO";181346,1;"Não";91;0;8411121,2;0;9884914,1;9716829,9;0;0;9115971,33;0;0;"nan";"Minas gerais";"Sudeste";FALSE;FALSE;-9884914,1
"139";"MG";"EMPRESA DE PESQUISA AGROPECUÁRIA DE MINAS GERAIS - EPAMIG";"ATIVA";"PESQUISA E ASSISTÊNCIA TÉCNICA AGROPECUÁRIA";"EMPRESA PÚBLICA";"Dependente";11515051,28;5007961,48;"SIM";"SIM";"NÃO";326649,9;"Não";676;1579959,17;84294304,98;0;88983305,71;91803198,73;0;0;31596840;0;0;"http://www,epamig,br/documentos-institucionais/";"Minas gerais";"Sudeste";FALSE;FALSE;-88983305,71
"140";"MG";"MINAS GERAIS PARTICIPAÇÕES S.A. - MGI";"ATIVA";"GESTÃO DE ATIVOS";"SOCIEDADE DE ECONOMIA MISTA";"Não Dependente";665136773,32;83460222,77;"SIM";"SIM";"SIM";177894,39;"Não";80;0;10522710,7;0;0;0;39741090,96;32602752,82;1224992629,8;38730489,95;0;"https://www,mgipart,com,br/governanca/PoliticasPublicasEGovernancas";"Minas gerais";"Sudeste";TRUE;FALSE;-39741090,96
"141";"MG";"MINAS GERAIS ADMINISTRAÇÃO E SERVIÇOS S.A. - MGS";"ATIVA";"OUTROS";"EMPRESA PÚBLICA";"Não Dependente";138895094,25;46047795,65;"SIM";"SIM";"SIM";437745,33;"Não";24812;197435;53143644,32;10668861,61;0;0;0;6e+07;91396104,12;0;0;"https://www,mgs,srv,br/detalhe-da-materia/info/cartas-anuais/16767";"Minas gerais";"Sudeste";TRUE;FALSE;10668861,61
"142";"MG";"TREM METROPOLITANO DE BELO HORIZONTE S.A - METROMINAS";"ATIVA";"TRANSPORTE";"EMPRESA PÚBLICA";"Não Dependente";99299;-1029760;"SIM";"SIM";"NÃO";179338,61;"Não";1;0;179339;0;0;0;210000;1042618;2365310;210000;210000;"nan";"Minas gerais";"Sudeste";FALSE;FALSE;-210000
"143";"MG";"COMPANHIA DE TECNOLOGIA DA INFORMAÇÃO DO ESTADO DE MINAS GERAIS - PRODEMGE";"ATIVA";"INFORMÁTICA E TECNOLOGIA DA INFORMAÇÃO";"SOCIEDADE DE ECONOMIA MISTA";"Não Dependente";104680934,8;33014592;"SIM";"SIM";"SIM";354000;"Não";1024;11568150;148078919,07;0;0;0;0;0;96481395;10694;10694;"https://www,prodemge,gov,br/governanca/carta-anual";"Minas gerais";"Sudeste";TRUE;FALSE;0
"144";"PR";"Instituto de Tecnologia do Paraná - TECPAR";"ATIVA";"SAÚDE";"EMPRESA PÚBLICA";"Não Dependente";44759749,15;-72873090,19;"SIM";"SIM";"SIM";319280,28;"Não";326;592290,74;41438446,44;0;0;0;0;0;0;-95965137,08;0;"nan";"Paraná";"Sul";TRUE;FALSE;0
"145";"PR";"Companhia de Saneamento do Estado do Paraná - SANEPAR";"ATIVA";"SANEAMENTO";"SOCIEDADE DE ECONOMIA MISTA";"Não Dependente";7826341484,92;1177630689,25;"SIM";"SIM";"SIM";923314,51;"Sim";6281;1320162486,26;1074986289,16;55661009,76;0;0;0;0;4e+09;0;-4941;"https://ri,sanepar,com,br/governanca-corporativa/praticas-de-governanca-corporativa/";"Paraná";"Sul";TRUE;FALSE;55661009,76
"146";"PR";"Agência de Fomento do Paraná S/A";"ATIVA";"FINANCEIRO";"SOCIEDADE DE ECONOMIA MISTA";"Não Dependente";1986681132,01;81340678,69;"SIM";"SIM";"SIM";495090,56;"Sim";196;112170,5;38276830,62;2330636,62;0;0;73114000;80330000;1646774000;73114000;73114;"https://www,fomento,pr,gov,br/sites/default/arquivos_restritos/files/documento/2021-07/carta_anual_de_governanca_-_2019-2020,pdf";"Paraná";"Sul";TRUE;FALSE;-70783363,38
"147";"PR";"Estrada de Ferro Paraná Oeste S/A";"ATIVA";"TRANSPORTE";"SOCIEDADE DE ECONOMIA MISTA";"Não Dependente";291054402,92;20783426,19;"SIM";"SIM";"NÃO";181999,79;"Não";129;0;7938252,87;0;0;0;0;0;406813516,67;0;0;"nan";"Paraná";"Sul";FALSE;FALSE;0
"148";"PR";"Companhia Paranaense de Energia - COPEL";"ATIVA";"ENERGIA";"SOCIEDADE DE ECONOMIA MISTA";"Não Dependente";22175239287,97;5048599696,83;"SIM";"SIM";"SIM";520699,26;"Sim";6396;6567918;1799626544,22;1175593036,61;0;0;0;0;1,08e+10;0;-11684;"https://api,mziq,com/mzfilemanager/v2/d/16a31b1b-5ecd-4214-a2e0-308a2393e330/5ff091e2-9b89-f72d-27ac-e15f2fd93356?origin=1";"Paraná";"Sul";TRUE;FALSE;1175593036,61
"149";"PR";"Companhia de Habitação do Paraná - COHAPAR";"ATIVA";"HABITAÇÃO E URBANIZAÇÃO";"SOCIEDADE DE ECONOMIA MISTA";"Dependente";1121532671,3;-96683542,16;"SIM";"SIM";"NÃO";534776,44;"Não";354;83780694,84;72003107,57;0;65743003,21;69541857,41;0;0;1355068585;0;0;"nan";"Paraná";"Sul";FALSE;FALSE;-65743003,21
"150";"PR";"Companhia de Tecnologia da INformação e Comunicação do Paraná - CELEPAR";"ATIVA";"INFORMÁTICA E TECNOLOGIA DA INFORMAÇÃO";"EMPRESA PÚBLICA";"Não Dependente";167653465;19333199;"SIM";"SIM";"SIM";324727,48;"Não";1083;22448493;170656995,25;0;0;0;0;0;1e+08;0;0;"nan";"Paraná";"Sul";TRUE;FALSE;0
"151";"PR";"Centrais de Abastecimento do Paraná S/A - CEASA";"ATIVA";"ABASTECIMENTO DE ALIMENTOS E OUTROS INSUMOS";"SOCIEDADE DE ECONOMIA MISTA";"Não Dependente";137751255,22;7653120,3;"SIM";"SIM";"NÃO";23238;"Não";55;8175765,59;15093889,64;0;0;0;0;2500000;30830825;0;0;"nan";"Paraná";"Sul";FALSE;FALSE;0
"152";"PR";"Administração dos Portos de Paranaguá e Antonina - APPA";"ATIVA";"PORTOS E HIDROVIAS";"EMPRESA PÚBLICA";"Não Dependente";1086443861,38;25476000;"SIM";"SIM";"SIM";467723,62;"Não";526;105899864,55;119777087,12;0;0;0;0;0;1086443861,38;0;0;"nan";"Paraná";"Sul";TRUE;FALSE;0
"153";"PB";"Companhia Paraibana de Gás";"ATIVA";"ENERGIA";"SOCIEDADE DE ECONOMIA MISTA";"Não Dependente";70182854;6858891;"SIM";"SIM";"SIM";255364,35;"Sim";105;9137742;17734350,71;67612,38;0;0;0;0;58028275,38;313702,850000001;1520;"https://pbgas,com,br/portal-da-transparencia/";"Paraíba";"Nordeste";TRUE;FALSE;67612,38
"154";"PB";"Companhia de Água e Esgotos da Paraíba";"ATIVA";"SANEAMENTO";"SOCIEDADE DE ECONOMIA MISTA";"Não Dependente";1097333000;172265000;"SIM";"SIM";"SIM";692217,51;"Não";2778;86164942,69;4114780;0;0;0;21069000;3420000;906938000;173590000;263019956281;"https://www,cagepa,pb,gov,br/carta-anual/";"Paraíba";"Nordeste";TRUE;FALSE;-21069000
"155";"PB";"Companhia de Processamento de Dados da Paraíba";"ATIVA";"INFORMÁTICA E TECNOLOGIA DA INFORMAÇÃO";"SOCIEDADE DE ECONOMIA MISTA";"Não Dependente";1736271,86;-3805861,95;"SIM";"SIM";"NÃO";402600,75;"Não";207;1275105,27;24726339,73;0;0;0;0;0;68623051,19;0;0;"Não tem";"Paraíba";"Nordeste";FALSE;FALSE;0
